{
  "contract": "game-snapshot",
  "contract_version": "1.1.0",
  "snapshot_id": "sha256:0123456789abcdef0123456789abcdef0123456789abcdef0123456789abcdef",
  "created_at": "2026-08-18T06:30:00Z",
  "source": {
    "target": "wot-eu",
    "publisher": "wargaming",
    "api_host": "https://wgus-woteu.wargaming.net",
    "resolved_app_id": "WOT.EU.PRODUCTION",
    "chain_id": "sd3_hd3",
    "client_type": "sd",
    "languages": ["EN"],
    "metadata_version": "20260310101200",
    "release_name": "2.3.1.5400",
    "version_vector": [
      { "name": "client", "version": "2.3.1.23990", "acquisition_mode": "reference" },
      { "name": "sdcontent", "version": "2.3.1.23990", "acquisition_mode": "reference" },
      {
        "name": "locale",
        "language": "EN",
        "version": "2.3.1.2598153",
        "acquisition_mode": "install-bundle"
      }
    ]
  },
  "payload": {
    "base_root": "sources/base",
    "locale_roots": { "EN": "sources/locales/EN" },
    "actionscript_root": "sources-as3",
    "stubs_root": "stubs",
    "overlay_order": ["base", "locale:{language}"]
  },
  "manifests": {
    "files": { "path": "manifests/files.jsonl", "sha256": "1111111111111111111111111111111111111111111111111111111111111111", "records": 100000 },
    "actionscript": { "path": "manifests/actionscript.jsonl", "sha256": "6666666666666666666666666666666666666666666666666666666666666666", "records": 12000 },
    "stubs": { "path": "manifests/stubs.jsonl", "sha256": "8888888888888888888888888888888888888888888888888888888888888888", "records": 100 },
    "packages": { "path": "manifests/packages.jsonl", "sha256": "2222222222222222222222222222222222222222222222222222222222222222", "records": 250 },
    "conflicts": { "path": "manifests/conflicts.jsonl", "sha256": "3333333333333333333333333333333333333333333333333333333333333333", "records": 0 }
  },
  "policies": {
    "vfs": { "name": "wot-paths-xml", "version": "1", "sha256": "4444444444444444444444444444444444444444444444444444444444444444" },
    "readable": { "name": "wot-readable", "version": "1", "sha256": "5555555555555555555555555555555555555555555555555555555555555555" },
    "source_tree": { "name": "wot-source-tree", "version": "1", "sha256": "7777777777777777777777777777777777777777777777777777777777777777" }
  },
  "tools": [
    { "name": "game-downloader", "version": "0.4.1", "source": "https://github.com/wotstat/game-unpack-pipeline" }
  ],
  "quality": {
    "unresolved_conflicts": 0,
    "required_transform_failures": 0,
    "unmanifested_payload_files": 0
  }
}
