{"contract":"game-snapshot","contract_version":"1.1.0","created_at":"2026-08-19T00:00:00Z","manifests":{"actionscript":{"path":"manifests/actionscript.jsonl","records":0,"sha256":"e3b0c44298fc1c149afbf4c8996fb92427ae41e4649b934ca495991b7852b855"},"conflicts":{"path":"manifests/conflicts.jsonl","records":0,"sha256":"e3b0c44298fc1c149afbf4c8996fb92427ae41e4649b934ca495991b7852b855"},"files":{"path":"manifests/files.jsonl","records":2,"sha256":"5cf03ba9ff7e49ba5e41d8459cce9a760414cd5c8f2c21018099ab75261cbd1c"},"packages":{"path":"manifests/packages.jsonl","records":0,"sha256":"e3b0c44298fc1c149afbf4c8996fb92427ae41e4649b934ca495991b7852b855"},"stubs":{"path":"manifests/stubs.jsonl","records":1,"sha256":"03c7bcd5c3b914c46cc50c0ed078beee174e6fac0bb19f5817bd702fd60e2cab"}},"payload":{"actionscript_root":"sources-as3","base_root":"sources/base","locale_roots":{"EN":"sources/locales/EN"},"overlay_order":["base","locale:{language}"],"stubs_root":"stubs"},"policies":{"readable":{"name":"fixture-readable","sha256":"2222222222222222222222222222222222222222222222222222222222222222","version":"1"},"source_tree":{"name":"wot-source-tree","sha256":"faca038142048a56e59f93a97bb42ecfb5353024150d7bbb60b674e7ada68a2c","version":"1"},"vfs":{"name":"fixture-vfs","sha256":"1111111111111111111111111111111111111111111111111111111111111111","version":"1"}},"quality":{"required_transform_failures":0,"unmanifested_payload_files":0,"unresolved_conflicts":0},"snapshot_id":"sha256:ff1b6b3850d6b61c8212803cf0d52c2a12e8f665f07f7ffd67f9287c3a8ccdaf","source":{"api_host":"https://example.invalid/","chain_id":"fixture-chain","client_type":"sd","languages":["EN"],"metadata_version":"1","publisher":"wargaming","release_name":"fixture","resolved_app_id":"FIXTURE","target":"fixture","version_vector":[{"acquisition_mode":"reference","name":"client","version":"1"},{"acquisition_mode":"reference","name":"sdcontent","version":"1"},{"acquisition_mode":"install-bundle","language":"EN","name":"locale","version":"1"}]},"tools":[{"name":"fixture-tool","version":"1"}]}
